{
  "updated": "2026-09-29",
  "schema_version": "1.0",
  "source_model": "MITRE ATT&CK group pages with supplemental public-source context",
  "adversaries": [
    {
      "id": "apt28",
      "name": "APT28",
      "attack_id": "G0007",
      "aliases": [
        "Fancy Bear",
        "Sofacy",
        "Sednit",
        "STRONTIUM",
        "Forest Blizzard",
        "FROZENLAKE"
      ],
      "actor_type": "state-sponsored",
      "attribution": "MITRE ATT&CK attributes the group to Russia's GRU Unit 26165.",
      "motivation": [
        "espionage",
        "strategic intelligence"
      ],
      "focus_regions": [
        "Europe",
        "NATO member countries",
        "global"
      ],
      "sectors": [
        "government",
        "defense",
        "research",
        "international organizations"
      ],
      "defensive_focus": [
        "identity security",
        "email security",
        "endpoint telemetry",
        "cloud identity"
      ],
      "profile_version": "5.3",
      "last_modified": "2026-07-31",
      "source": "https://attack.mitre.org/groups/G0007/",
      "source_tier": "A"
    },
    {
      "id": "apt29",
      "name": "APT29",
      "attack_id": "G0016",
      "aliases": [
        "Cozy Bear",
        "The Dukes",
        "NOBELIUM",
        "UNC2452",
        "Midnight Blizzard"
      ],
      "actor_type": "state-sponsored",
      "attribution": "MITRE ATT&CK attributes the group to Russia's Foreign Intelligence Service (SVR).",
      "motivation": [
        "espionage",
        "strategic intelligence"
      ],
      "focus_regions": [
        "Europe",
        "NATO member countries",
        "global"
      ],
      "sectors": [
        "government",
        "research",
        "think tanks",
        "technology"
      ],
      "defensive_focus": [
        "cloud identity",
        "supply-chain risk",
        "identity security",
        "email security"
      ],
      "profile_version": "6.2",
      "last_modified": "2026-07-31",
      "source": "https://attack.mitre.org/groups/G0016/",
      "source_tier": "A"
    },
    {
      "id": "sandworm",
      "name": "Sandworm Team",
      "attack_id": "G0034",
      "aliases": [
        "Voodoo Bear",
        "IRIDIUM",
        "Seashell Blizzard",
        "APT44"
      ],
      "actor_type": "state-sponsored",
      "attribution": "MITRE ATT&CK attributes the group to Russia's GRU Unit 74455.",
      "motivation": [
        "disruption",
        "destructive operations",
        "strategic objectives"
      ],
      "focus_regions": [
        "Ukraine",
        "Europe",
        "global"
      ],
      "sectors": [
        "government",
        "energy",
        "critical infrastructure",
        "international organizations"
      ],
      "defensive_focus": [
        "critical infrastructure resilience",
        "ICS monitoring",
        "identity security",
        "recovery engineering"
      ],
      "profile_version": "4.2",
      "last_modified": "2026-07-31",
      "source": "https://attack.mitre.org/groups/G0034/",
      "source_tier": "A"
    },
    {
      "id": "turla",
      "name": "Turla",
      "attack_id": "G0010",
      "aliases": [
        "Waterbug",
        "Snake",
        "Venomous Bear",
        "Secret Blizzard"
      ],
      "actor_type": "state-sponsored",
      "attribution": "MITRE ATT&CK reports attribution to Russia's Federal Security Service (FSB).",
      "motivation": [
        "espionage",
        "strategic intelligence"
      ],
      "focus_regions": [
        "Europe",
        "global"
      ],
      "sectors": [
        "government",
        "diplomatic",
        "defense",
        "education",
        "research",
        "pharmaceutical"
      ],
      "defensive_focus": [
        "network telemetry",
        "endpoint visibility",
        "email security",
        "identity monitoring"
      ],
      "profile_version": "5.1",
      "last_modified": "2026-07-31",
      "source": "https://attack.mitre.org/groups/G0010/",
      "source_tier": "A"
    },
    {
      "id": "gamaredon",
      "name": "Gamaredon Group",
      "attack_id": "G0047",
      "aliases": [
        "Primitive Bear",
        "ACTINIUM",
        "Armageddon",
        "Aqua Blizzard"
      ],
      "actor_type": "state-sponsored",
      "attribution": "MITRE ATT&CK reports public attribution to Russia's FSB Center 18.",
      "motivation": [
        "espionage",
        "strategic intelligence"
      ],
      "focus_regions": [
        "Ukraine"
      ],
      "sectors": [
        "government",
        "military",
        "law enforcement",
        "non-governmental organizations"
      ],
      "defensive_focus": [
        "email security",
        "endpoint telemetry",
        "network telemetry",
        "user-awareness signals"
      ],
      "profile_version": "3.3",
      "last_modified": "2026-07-31",
      "source": "https://attack.mitre.org/groups/G0047/",
      "source_tier": "A"
    },
    {
      "id": "apt41",
      "name": "APT41",
      "attack_id": "G0096",
      "aliases": [
        "Wicked Panda",
        "Brass Typhoon",
        "BARIUM"
      ],
      "actor_type": "mixed",
      "attribution": "MITRE ATT&CK describes APT41 as a Chinese state-sponsored espionage group that has also conducted financially motivated operations.",
      "motivation": [
        "espionage",
        "financial"
      ],
      "focus_regions": [
        "Asia",
        "Europe",
        "North America",
        "global"
      ],
      "sectors": [
        "healthcare",
        "telecommunications",
        "technology",
        "finance",
        "education",
        "retail",
        "gaming"
      ],
      "defensive_focus": [
        "internet-facing services",
        "identity security",
        "web telemetry",
        "database monitoring"
      ],
      "profile_version": "4.2",
      "last_modified": "2026-07-31",
      "source": "https://attack.mitre.org/groups/G0096/",
      "source_tier": "A"
    },
    {
      "id": "volt-typhoon",
      "name": "Volt Typhoon",
      "attack_id": "G1017",
      "aliases": [
        "Vanguard Panda",
        "DEV-0391",
        "UNC3236",
        "Voltzite",
        "Insidious Taurus"
      ],
      "actor_type": "state-sponsored",
      "attribution": "MITRE ATT&CK describes Volt Typhoon as a PRC state-sponsored actor.",
      "motivation": [
        "strategic access",
        "pre-positioning"
      ],
      "focus_regions": [
        "United States",
        "Guam"
      ],
      "sectors": [
        "critical infrastructure",
        "communications",
        "operational technology"
      ],
      "defensive_focus": [
        "network-device monitoring",
        "identity security",
        "edge-device inventory",
        "OT segmentation"
      ],
      "profile_version": "2.0",
      "last_modified": "2026-07-31",
      "source": "https://attack.mitre.org/groups/G1017/",
      "source_tier": "A"
    },
    {
      "id": "salt-typhoon",
      "name": "Salt Typhoon",
      "attack_id": "G1045",
      "aliases": [],
      "actor_type": "state-sponsored",
      "attribution": "MITRE ATT&CK describes Salt Typhoon as a PRC state-backed actor.",
      "motivation": [
        "espionage",
        "strategic intelligence"
      ],
      "focus_regions": [
        "United States",
        "global telecommunications"
      ],
      "sectors": [
        "telecommunications",
        "internet service providers",
        "network infrastructure"
      ],
      "defensive_focus": [
        "network-device monitoring",
        "telecommunications security",
        "identity security",
        "configuration integrity"
      ],
      "profile_version": "1.0",
      "last_modified": "2026-07-31",
      "source": "https://attack.mitre.org/groups/G1045/",
      "source_tier": "A"
    },
    {
      "id": "mustang-panda",
      "name": "Mustang Panda",
      "attack_id": "G0129",
      "aliases": [
        "TA416",
        "RedDelta",
        "BRONZE PRESIDENT",
        "STATELY TAURUS",
        "CAMARO DRAGON",
        "EARTH PRETA"
      ],
      "actor_type": "state-sponsored",
      "attribution": "MITRE ATT&CK describes Mustang Panda as a China-based cyber espionage threat actor.",
      "motivation": [
        "espionage",
        "strategic intelligence"
      ],
      "focus_regions": [
        "Asia",
        "Europe",
        "United States"
      ],
      "sectors": [
        "government",
        "diplomatic",
        "non-governmental organizations",
        "research",
        "religious institutions"
      ],
      "defensive_focus": [
        "email security",
        "endpoint telemetry",
        "identity monitoring",
        "document-analysis workflows"
      ],
      "profile_version": "3.0",
      "last_modified": "2026-07-31",
      "source": "https://attack.mitre.org/groups/G0129/",
      "source_tier": "A"
    },
    {
      "id": "blacktech",
      "name": "BlackTech",
      "attack_id": "G0098",
      "aliases": [
        "Palmerworm"
      ],
      "actor_type": "suspected-state-linked",
      "attribution": "MITRE ATT&CK describes BlackTech as a suspected Chinese cyber espionage group.",
      "motivation": [
        "espionage"
      ],
      "focus_regions": [
        "Taiwan",
        "Japan",
        "Hong Kong",
        "United States"
      ],
      "sectors": [
        "media",
        "construction",
        "engineering",
        "electronics",
        "finance"
      ],
      "defensive_focus": [
        "network infrastructure",
        "endpoint telemetry",
        "certificate monitoring",
        "identity security"
      ],
      "profile_version": "2.0",
      "last_modified": "2026-07-31",
      "source": "https://attack.mitre.org/groups/G0098/",
      "source_tier": "A"
    },
    {
      "id": "lazarus",
      "name": "Lazarus Group",
      "attack_id": "G0032",
      "aliases": [
        "Labyrinth Chollima",